{
  "version": "0.1",
  "snapshot_id": "rev-2026-04-13T14:31:00Z",
  "source_id": "revoke-main",
  "observed_at": "2026-04-13T14:30:00Z",
  "fresh_until": "2026-04-13T14:31:00Z",
  "issuer_epoch": 12,
  "revoked_issuers": [],
  "revoked_jtis": [],
  "revoked_secret_epochs": [
    8,
    12
  ],
  "revoked_secret_versions": [
    "db/analytics#12"
  ]
}
